{
  "$schema": "https://json-schema.org/draft/2020-12/schema",
  "type": "object",
  "properties": {
    "id": {
      "type": "string",
      "pattern": "^[a-z0-9]+(?:-[a-z0-9]+)*$"
    },
    "slug": {
      "type": "string",
      "pattern": "^[a-z0-9]+(?:-[a-z0-9]+)*$"
    },
    "status": {
      "type": "string",
      "enum": [
        "draft",
        "published",
        "unpublished",
        "archived"
      ]
    },
    "title": {
      "type": "string",
      "minLength": 1
    },
    "short_description": {
      "type": "string"
    },
    "body": {
      "type": "string"
    },
    "source_url": {
      "type": "string"
    },
    "reference_links": {
      "type": "array",
      "items": {
        "type": "object",
        "properties": {
          "url": {
            "type": "string"
          },
          "title": {
            "type": "string",
            "minLength": 1
          }
        },
        "required": [
          "url",
          "title"
        ],
        "additionalProperties": false
      }
    },
    "image_file": {
      "anyOf": [
        {
          "type": "string"
        },
        {
          "type": "null"
        }
      ]
    },
    "image_url": {
      "anyOf": [
        {
          "type": "string"
        },
        {
          "type": "null"
        }
      ]
    },
    "category_ids": {
      "type": "array",
      "items": {
        "type": "string",
        "pattern": "^[a-z0-9]+(?:-[a-z0-9]+)*$"
      }
    },
    "tag_ids": {
      "type": "array",
      "items": {
        "type": "string",
        "pattern": "^[a-z0-9]+(?:-[a-z0-9]+)*$"
      }
    },
    "related_product_ids": {
      "type": "array",
      "items": {
        "type": "string",
        "minLength": 1
      }
    },
    "created_at": {
      "type": "string",
      "pattern": "^\\d{4}-\\d{2}-\\d{2}T\\d{2}:\\d{2}:\\d{2}[+-]\\d{2}:\\d{2}$"
    },
    "updated_at": {
      "type": "string",
      "pattern": "^\\d{4}-\\d{2}-\\d{2}T\\d{2}:\\d{2}:\\d{2}[+-]\\d{2}:\\d{2}$"
    },
    "published_at": {
      "anyOf": [
        {
          "type": "string",
          "pattern": "^\\d{4}-\\d{2}-\\d{2}T\\d{2}:\\d{2}:\\d{2}[+-]\\d{2}:\\d{2}$"
        },
        {
          "type": "null"
        }
      ]
    },
    "unpublished_at": {
      "anyOf": [
        {
          "type": "string",
          "pattern": "^\\d{4}-\\d{2}-\\d{2}T\\d{2}:\\d{2}:\\d{2}[+-]\\d{2}:\\d{2}$"
        },
        {
          "type": "null"
        }
      ]
    },
    "archived_at": {
      "anyOf": [
        {
          "type": "string",
          "pattern": "^\\d{4}-\\d{2}-\\d{2}T\\d{2}:\\d{2}:\\d{2}[+-]\\d{2}:\\d{2}$"
        },
        {
          "type": "null"
        }
      ]
    }
  },
  "required": [
    "id",
    "slug",
    "status",
    "title",
    "short_description",
    "source_url",
    "category_ids",
    "tag_ids",
    "related_product_ids",
    "created_at",
    "updated_at",
    "published_at",
    "unpublished_at",
    "archived_at"
  ],
  "additionalProperties": false
}
