{
  "id": "2026-06-19-food-waste-processor-guide",
  "slug": "2026-06-19-food-waste-processor-guide",
  "status": "published",
  "title": "廚餘機怎麼選：三台實測比較",
  "short_description": "整理三款家用廚餘機的實際使用比較：Byee（砍碎烘乾型）、Rindon（冷凍儲存型）與 Foodcycler（砍碎烘乾型），記錄各機在處理能力、設計細節、噪音與耐用度上的差異與限制。",
  "body": "又有人在問廚餘機，然後我發現我沒有獨立發文，所以只好整理一下\n\n先講結論\n\n廚餘機是好東西，每個人家裡都應該要有一台。政府應該要出錢補助，這樣可以延長焚化爐的壽命。\n\n我自己有買的是 Byee 跟 Rindon。Byee 是砍碎烘乾的構型，Rindon 是廚餘專用冰箱。\n\n## Byee\n\nByee 正常工作的時候還蠻優秀的，煮熟的廚餘都可以輕易砍碎、烘乾（看附圖）。雞骨頭之類的他也還可以處理，但是豬骨頭就不建議放進去。\n\n但是他對果皮之類的生廚餘就沒辦法處理了，常常看到哈密瓜皮處理完一輪還是哈密瓜皮，而且沒有烘到夠乾。內鍋的不沾鍋層會隨著使用而逐漸剝落，但是有烤乾的話還是不太會黏，問題不大。\n\n最後他在收到貨之後的 13 個月壞掉了，然後代理商完全不回我信，我機器還留著準備要找時間去砸店，簡稱 Byee bye~。（[Dcard 討論](https://www.dcard.tw/f/buyonline/p/236915018)）\n\n## Rindon\n\nRindon 理論上是我會比較喜歡的設計，價錢也比較便宜。他是直接把廚餘冷凍起來，可以直接拿著內桶去倒的設計。但是他的設計細節上充滿了各種缺點，整體而言不是很推：\n\n- 內桶跟外桶之間縫細太大，廚餘會掉進中間的空間\n- 而且那個空間的下方還有一片不知道幹嘛用的塑膠片，會增加清洗的麻煩\n- 而且他蓋子的卡榫設計也不太對，固定上蓋的力道不夠\n- 而且卡榫的方向還不夠直覺，是要往下掰開關，而不是往上跟著蓋子一起打開\n\n最重要的是，他超級吵的，吵到像是放了一台冰箱在廚房裡（喔等等，他真的是一台冰箱）。（[Mobile01 討論](https://www.mobile01.com/topicdetail.php?f=729&t=6604805)）\n\n## Foodcycler\n\n目前看起來比較可以買的是 Foodcycler，他出貨也一年多了，目前沒有聽到像 byee 那麼多維修慘劇。（[PChome 商品頁](https://24h.pchome.com.tw/prod/DMAG0K-A900GEUNW)）\n\n不過 Foodcycler 原始版本的內桶只有 2.5L，我可能煮個咖哩就會把他塞滿，我建議還是買正在預購的 Pro 版，這個等我收到貨再來 review。（[zeczec 預購頁](https://www.zeczec.com/projects/foodcycler-pro)）\n\n「我還得再買多少個廚餘桶才夠？Zero 系統什麼都沒有告訴我」（顯示為無盡的華爾滋",
  "source_url": "https://www.facebook.com/share/p/17uJp94PvZ/",
  "image_file": null,
  "image_url": null,
  "category_ids": [
    "kitchen-appliance"
  ],
  "tag_ids": [
    "kitchen"
  ],
  "related_product_ids": [],
  "created_at": "2026-06-19T00:00:00+08:00",
  "updated_at": "2026-06-19T00:00:00+08:00",
  "published_at": "2026-06-19T00:00:00+08:00",
  "unpublished_at": null,
  "archived_at": null
}
