{
  "id": "2026-06-23-robot-vacuum-irobot-alternatives",
  "slug": "2026-06-23-robot-vacuum-irobot-alternatives",
  "status": "published",
  "title": "iRobot 易主後的掃地機器人品牌選擇",
  "short_description": "在 iRobot 被中國代工廠收購、不建議再入手新機的前提下，整理三家替代品牌：Electrolux（規格普通但價格約 10k）、LG（集塵塔仍是三年前高塔設計，約 15k）與 HOBOT（新機外型討喜但尚未見實機，約 20k）並各述優劣。結論仍是不推拖地功能，因為集塵底座可兩個月免管，拖地卻得天天換水。",
  "body": "朋友「有個深宮怨婦在抱怨跪在地上擦地，你不去推個坑嗎？」我「人家身價幾十億的哪裡需要我推？」不過在座各位身價只有數十～數千萬的同學，應該還是可以看一下。\n\n最近 iRobot 被他們的中國代工廠買下來了，雖然理論上公司還是登記在美國，短期間內可能不會直接炸掉，但是我也不是很建議買他們家的新機器。那剩下誰可以買？\n\n## 瑞典代表 Electrolux\n\n他們這台現在規格不行，但是價格很便宜還是可以考慮，10k 左右。（[PChome 商品頁](https://24h.pchome.com.tw/prod/DMBH03-A900HLY01)）\n\n## 韓國代表 LG\n\n他們家的掃地機器人一直給我一種「有做，但不多」的感覺，像是現行機種的集塵塔還是三年前的那種高塔設計（囧），15k 左右。（[PChome 商品頁](https://24h.pchome.com.tw/prod/DMBL0I-A900G2992)）\n\n## 台灣代表 HOBOT\n\n我對他們家近過去的表現不是很滿意，但是新的這台看起來好像比較可愛，我還沒看過實機表演就是了，20k 左右。（[PChome 商品頁](https://24h.pchome.com.tw/prod/DMBL0P-A900IW7Y7)）\n\n還是要再說一次，我真的不推拖地功能。好不容易有集塵底座可以兩個月不管他，你還在那邊拖地等於要天天換水伺候他。",
  "source_url": "https://www.facebook.com/share/p/1Bo1uo4V6j/",
  "image_file": null,
  "image_url": null,
  "category_ids": [
    "small-appliance"
  ],
  "tag_ids": [
    "cleaning"
  ],
  "related_product_ids": [],
  "created_at": "2026-06-23T00:00:00+08:00",
  "updated_at": "2026-06-23T00:00:00+08:00",
  "published_at": "2026-06-23T00:00:00+08:00",
  "unpublished_at": null,
  "archived_at": null
}
