{
  "id": "2026-06-02-aeron-chair",
  "slug": "2026-06-02-aeron-chair",
  "status": "published",
  "title": "Aeron Chair",
  "short_description": "我上次椅子壞掉備料三個月，我只好先再買一張等雅浩叫料。下次如果再壞掉的話，我就自己把椅子拖到他們辦公室去砸",
  "body": "總之雅浩就別買了\n\n不備料、不含運、不想賣\n\nHerman Miller 台灣代理商雅浩自 2025 年 10 月起，連保固內的維修都要消費者自付來回運費，依產品與地區從 5000 到 10000 不等，引發保固到底還算不算保固的討論。",
  "source_url": "https://www.facebook.com/share/p/165wXVWFFW/",
  "image_url": null,
  "category_ids": [
    "computer-3c"
  ],
  "tag_ids": [
    "ergonomic"
  ],
  "related_product_ids": [],
  "created_at": "2026-06-02T00:00:00+08:00",
  "updated_at": "2026-06-02T00:00:00+08:00",
  "published_at": "2026-06-02T00:00:00+08:00",
  "unpublished_at": null,
  "archived_at": null,
  "image_file": "2026-06-02-aeron-chair.jpg"
}
