{
  "id": "2026-06-19-robot-vacuum-brand-guide",
  "slug": "2026-06-19-robot-vacuum-brand-guide",
  "status": "published",
  "title": "掃地機器人品牌支援與選購整理",
  "short_description": "整理常見掃地機器人品牌（石頭、追覓、科沃斯、小米、海爾、雲米等）的支援度與淘汰名單（iRobot、HOBOT、LG、Electrolux），並逐家說明規格、價格與耐用度考量，最後收斂出在不採用擦地機前提下的單一機型選購結論。",
  "body": "應觀眾要求，整理一下比較大的掃地機器人品牌\n\n### 支\n\n- roborock 石頭科技\n- dreame 追覓科技\n- ECOVACS 科沃斯／添可\n- 小米 Xiaomi\n- Haier 海爾\n- VIOMI 雲米\n\n### 不支\n\n- iRobot\n- HOBOT 玻妞\n- LG 樂金\n- Electrolux\n\n## 前言\n\n總之我不推擦地機。\n\nHOBOT 應該是台灣牌子，但是他們家的產品我覺得不上不下的，規格不夠好、價錢不夠便宜，你們自行斟酌。\n\nLG 的規格開的還不錯，價錢也不錯，而且高低階都有。問題是他們家的耐用度我不是很放心。\n\nElectrolux 現在只剩低階機，我覺得不能買。\n\n所以我現在只剩 Roomba 可以選。然後我又不推擦地機，所以扣來扣去就是只有 Roomba j7+ 一擇。",
  "source_url": "https://www.facebook.com/share/p/18uA2deRjs/",
  "image_file": null,
  "image_url": null,
  "category_ids": [
    "small-appliance"
  ],
  "tag_ids": [
    "cleaning"
  ],
  "related_product_ids": [],
  "created_at": "2026-06-19T00:00:00+08:00",
  "updated_at": "2026-06-19T00:00:00+08:00",
  "published_at": "2026-06-19T00:00:00+08:00",
  "unpublished_at": null,
  "archived_at": null
}
