{
  "id": "2026-06-19-projector-buying-guide",
  "slug": "2026-06-19-projector-buying-guide",
  "status": "published",
  "title": "投影機採購指南",
  "short_description": "DW 的投影機選購建議：Rule 0 是 80 吋以下直接買電視，省去亮度、焦距與燈泡壽命的煩惱。點出投影機在便宜、清楚、小巧三者只能取其二——微型機解析度差、好的 FHD 小型機昂貴、便宜又高亮的 FHD 機則體積龐大。",
  "body": "Rule 0：投 80\" 以下，直接買電視。現在 65\" 才 23888，不用煩惱亮度、焦距、燈泡壽命問題。（[PChome 商品頁](https://24h.pchome.com.tw/prod/DPADIK-A900A1K2U?fq=/S/DPADOY)）\n\n我沒有其他要補充的了。\n\n投影機還要買布幕、調焦距，看的時候還要關燈，很麻煩的啦。\n\n還不死心的話，三個願望一次只能滿足兩個：\n\n- 要便宜、要小：解析度就很爛\n- 要清楚、要小：價格就很貴\n- 要便宜、要清楚：體積就很大\n\n微型投影機幾乎都是 854*480 之類的，打 60 吋以上就是糊掉的馬賽克大戰。（[PChome 商品頁](https://24h.pchome.com.tw/prod/DPAE0Q-A9009ZOT1?fq=/S/DPAE03)）\n\n然後好一點的 FHD 小型投影機，價格就整個貴。（[PChome 商品頁](https://24h.pchome.com.tw/prod/DPAE5E-A900AA7CT)）\n\n然後 FHD、高亮度、便宜的機器，體積就整個大。（[PChome 商品頁](https://24h.pchome.com.tw/prod/DPAE0D-A900A0TYU)）",
  "source_url": "https://www.facebook.com/share/p/1FCRcUr5s2/",
  "image_file": "2026-06-19-projector-buying-guide.jpg",
  "image_url": null,
  "category_ids": [
    "av-theater"
  ],
  "tag_ids": [
    "display"
  ],
  "related_product_ids": [],
  "created_at": "2026-06-19T00:00:00+08:00",
  "updated_at": "2026-06-19T00:00:00+08:00",
  "published_at": "2026-06-19T00:00:00+08:00",
  "unpublished_at": null,
  "archived_at": null
}
