{
  "id": "2026-06-19-home-theater-buying-guide",
  "slug": "2026-06-19-home-theater-buying-guide",
  "status": "published",
  "title": "家庭劇院採購指南",
  "short_description": "DW 的家庭劇院採購指南：預算不足就直接 HomePod＋Apple TV，或請音響店裝 Bose 省事；要自組則建議擴大機／主聲道／重低音／中置環繞／腳架線材各約兩成預算，喇叭以主聲道與重低音優先，文末另附 Dolby Atmos 7.1.4 配置與喇叭線建議。",
  "body": "先準備十萬塊。低於這個預算的話就買 Ambeo Max，預算更低的話就買 Homepod（大）+ Apple TV。\n\n「大賣場賣的一組兩萬多塊家庭劇院可以買嗎」不行，你還是去買 Homepod（大）。\n\n直接找音響店，請他們來裝 Bose Lifestyle 600。本劇終。\n\n．．．\n\n我是認真的啦。家庭劇院就是要花錢解決問題，自己搞就是花更多錢還製造更多問題（顯示為玩具召喚了更多玩具，而且玩具間還會交互作用\n\n．．．\n\n嘖，還不放棄嗎。既然你這麼想自找麻煩，那就繼續看下去。\n\n## 預算分配\n\n預算分配大概長這樣：\n\n- 擴大機 20%\n- 主聲道 20%\n- 重低音 20%\n- 中置 + 環繞 20%\n- 腳架線材墊材之類的 20%\n\n環繞擴大機基本上是個 25K~35K 的固定開支。太低階的基本上是隨時會被換掉的玩具，要賣也不會有人接手；太旗艦的可能三五年後就會被新的數位規格出來而淘汰價錢突然變很爛。我覺得買中階或中高階機比較好，保留多一點擴充空間比較好玩。\n\n## 喇叭怎麼配\n\n你聽音樂的時候絕大多數都是兩聲道，所以主聲道的喇叭要買好一點。你看電影的時候最有感的都是重低音，所以重低音也可以買好一點。環繞喇叭基本上就是有聲音就好了，可以不要太計較音質（但是要計較位置跟數量\n\n預算不夠買齊喇叭的話，購買順序我覺得應該是這樣：\n\n- 主聲道\n- 重低音\n- 側環繞\n- 中置\n- 後環繞或天空聲道\n\n如果你在做裝潢的話，最好把所有的環繞喇叭線都預先牽好，要不要裝是以後再說的事。喇叭線就買 Canare 4s6 或 4s8，便宜好用、音質又不會太差。\n\n附圖是 Dolby Atmos 推薦的 7.1.4 聲道配置。但是你如果直接拿這張圖去給設計師，又拿不出像樣的預算的話，可能會被當成奧客攢出來，請千萬小心。",
  "source_url": "https://www.facebook.com/share/p/1CWGSebiLR/",
  "image_file": "2026-06-19-home-theater-buying-guide.jpg",
  "image_url": null,
  "category_ids": [
    "av-theater"
  ],
  "tag_ids": [
    "amplifier",
    "speaker"
  ],
  "related_product_ids": [],
  "created_at": "2026-06-19T00:00:00+08:00",
  "updated_at": "2026-06-19T00:00:00+08:00",
  "published_at": "2026-06-19T00:00:00+08:00",
  "unpublished_at": null,
  "archived_at": null
}
