{
  "id": "2026-06-19-vacuum-buying-guide",
  "slug": "2026-06-19-vacuum-buying-guide",
  "status": "published",
  "title": "掃地／吸塵器選購建議",
  "short_description": "整理掃地機器人與吸塵器的選牌邏輯，主張優先選擇長期存活、耗材供應穩定的品牌（如 iRobot Roomba、Neato、Electrolux、LG、Dyson），並說明吸力衰退與耗材停產是評測數字看不出的長期風險。",
  "body": "（順便貼過來\n\n簡單的說，掃地機器人都不要用眼睛看，看到任何新牌子等他五年後還存在再說。所有中國牌子都是花錢業配買榜單，評價通通做不得準。\n\n具體一點的說，除了 roomba／neato／Electrolux／LG／Dyson 之外都不要相信網路上看到的評測（當然更不要相信電視跟雜誌上的\n\npanasonic 出過、收掉了；twinbird 出過、收掉了；makita 也出過、也收掉了。結論就是日系品牌太晚進入市場，又做不到中國牌子的超便宜，變得不上不下的兩邊都輸。\n\n## 為什麼新品數字不能信\n\n放慢一點的說，吸塵器這東西很邪門，全新的時候大家吸力都很強，可是你用了一陣子之後就會開始迅速衰退。不管是濾網卡住、濾杯塞滿、馬達軸承卡住、電池蓄電量下降，總之有各種原因造成他效能迅速下滑。\n\n中國牌子可以用 50% 價格做到新品 90% 效能，然後衰退數字就不管了，反正便宜了爛掉就丟掉。只有做吸塵器的廠商才會知道怎麼抑制這些毛病的 know-how，但是一般消費者沒在管這個，看新品測試數字很厲害、很便宜就買了（捅\n\n## 耗材也是問題\n\n然後各種中國牌子還有另一個問題，即使品牌還在，你的耗材第三年之後就會買不到了。另一方面，roomba 600 系到現在還繼續生產，你要什麼耗材通通有。\n\nroomba 的耗材某程度而言更邪門就是了，之前買的時候都送一大堆，然後一直用不完。我手邊的 600 系耗材還有多，除了自己的這兩台之外，還接手了朋友多出來的⋯⋯",
  "source_url": "https://www.facebook.com/share/p/18mbp9t659/",
  "image_file": null,
  "image_url": null,
  "category_ids": [
    "small-appliance"
  ],
  "tag_ids": [
    "cleaning"
  ],
  "related_product_ids": [],
  "created_at": "2026-06-19T00:00:00+08:00",
  "updated_at": "2026-06-19T00:00:00+08:00",
  "published_at": "2026-06-19T00:00:00+08:00",
  "unpublished_at": null,
  "archived_at": null
}
