{
  "id": "2026-06-02-japanese-rice-intro",
  "slug": "2026-06-02-japanese-rice-intro",
  "status": "published",
  "title": "日本米入門篇",
  "short_description": "參考資料那篇也要看，主要是台灣米",
  "body": "（順便貼過來\n\n總之先買台灣的這幾種，吃完了再來換日本米比較看看\n\n- [越光米](https://24h.pchome.com.tw/prod/DBBY0M-A900C8U3O)\n- [台南16號](https://24h.pchome.com.tw/prod/DBBY0M-A900CA31V)\n- [牛奶皇后](https://24h.pchome.com.tw/prod/DBBY0J-A9009D3Q3)\n\niris 有[品牌米組合](https://www.irisohyamatw.com/products/rice-set-gomeigara)比比看，先試試看喜歡什麼方向的，官網現在買三送一，四包合計 $1500 而已（？\n\n然後去找那個附近的其他品牌米試試看（看附圖），可以參考[三菱電機的品牌米地圖](https://www.mitsubishielectric.co.jp/home/suihanki/okomejuku/rice/ricebrand/)。其實我對右下角的青天霹靂還蠻有興趣的，但是一直找不到機會買來吃\n\n洗米的秘訣可以看[這篇煮出日式白飯的教學](https://foodieat.tw/%E7%85%AE%E5%87%BA%E6%97%A5%E5%BC%8F%E7%99%BD%E7%B1%B3%E9%A3%AF/)。是說量米的時候可以直接量一杯 150g，不要用體積算，誤差會比較大\n\n順便的順便貼一下洗米器 銀しゃり名人，基本上是無動力洗衣機，可以很迅速、均勻的洗好米，不過我覺得可能不太容易倒進電鍋裡（[YouTube 示範](https://www.youtube.com/watch?v=U5KWxtJCyVM)）。\n\n最後還是再推一次[本炭釜 KAMADO](https://www.amazon.co.jp/dp/B07TX62P2M)，這張圖都是他有內建的煮飯行程，三菱電機在實驗室裡面幫我們逐一測量過最理想狀態了。現在雖然比我去年買的價格貴了 15% 左右，但是日幣也貶值了 15%，要付的台幣是差不多的",
  "source_url": "https://www.facebook.com/share/p/1DHBMUMSLQ/",
  "reference_links": [
    {
      "title": "Facebook 參考貼文：順便整理一下最近買的米",
      "url": "https://www.facebook.com/applepig/posts/pfbid08r2XCS2kfPtkUKa7DETQiayJyKgab8vg1C9fg4kMVSpi2nqPhYJTwcigdR7xVG3Ll"
    }
  ],
  "image_file": "2026-06-02-japanese-rice-intro.jpg",
  "image_url": null,
  "category_ids": [
    "household"
  ],
  "tag_ids": [
    "rice"
  ],
  "related_product_ids": [],
  "created_at": "2026-06-02T00:00:00+08:00",
  "updated_at": "2026-07-13T00:00:00+08:00",
  "published_at": "2026-06-02T00:00:00+08:00",
  "unpublished_at": null,
  "archived_at": null
}
