{
  "id": "2026-06-19-dishwasher-buying-guide",
  "slug": "2026-06-19-dishwasher-buying-guide",
  "status": "published",
  "title": "果果豬的洗碗機採購指南",
  "short_description": "DW 的洗碗機採購指南，結論是買就對了、唯一問題是擺哪。內文把洗碗機分成櫥下式、櫥下抽屜式、桌面式、桌面水箱式、獨立落地式五大類型，逐一比較烘乾、容量、進水方式、安裝彈性與價格。",
  "body": "先講結論\n\n買。\n\n唯一的問題是「買了要擺哪」\n\n簡單的說，洗碗機大概分這幾種\n\n- 櫥下式：Bosch 或 Panasonic\n- 櫥下抽屜式：Fisher & Paykel 或林內\n- 桌面式：Panasonic\n- 桌面水箱型：Toshiba 或其他支牌\n- 獨立落地式：Bosch\n\n## 櫥下式\n\n賣的最好的應該是 Bosch，而且型號也多，應該比較容易找到適合你家櫥櫃的款式。不過他們家的沒有獨立烘乾功能，最好洗完當天就拿出來。（[Bosch 產品頁](https://www.bosch-home.com.tw/zh/mkt-category/dishwashers)）\n\n我是比較喜歡 Panasonic 的那台，他有獨立烘乾功能，不洗碗也能當烘乾機用。碗盤架也比較符合我們的吃飯習慣，我們買歐規的洗碗機常常會有「哪來這麼多盤子要洗」的不合。（[Panasonic 產品頁](https://www.panasonic.com/tw/consumer/kitchen/dishwasher.html)）\n\n## 櫥下抽屜式\n\n這算是比較異端的流派，不過我很喜歡這個概念。他的設計上是個很深的抽屜，不需要彎腰就能把碗盤放進去，不過相對的就是放進去之後會比較難重新挑戰。（[PChome 商品頁](https://24h.pchome.com.tw/prod/DPAC6C-A900F9LYI)）\n\n林內的洗碗機則是異端中的異端，長得不好看、又貴、容量又小。不過他是唯一進水可以吃熱水的機器，就比較省電。（[林內產品頁](https://www.rinnai.com.tw/Product/V2/1/6)）\n\n## 桌面式\n\n單推 NP-TH4（或他的兄弟），我家就是裝這台，他的深度比較淺一點。你要裝在廚房檯面的話，前面還能留下一點點的砧板空間。（[PChome 商品頁](https://24h.pchome.com.tw/prod/DMBM1K-A900FXGQ0)）\n\n如果廚房裝不下的話，也是可以裝在洗衣機上面，進水跟排水都可以跟洗衣機共用，直接往滾筒洗衣機上面放就好了。本來這邊是要放 Mistral 的，但是他們最近不知道怎麼了網購都沒賣。\n\n## 桌面水箱式\n\n基本上是支牌的天下。Toshiba 的白色家電也是賣給中國大廠 Midea 了（合掌\n\n這個分類便宜的選擇很多，長得也都像支牌 oem 的，我覺得就隨便啦（縮。（[PChome 商品頁](https://24h.pchome.com.tw/prod/DMBR0P-A900HBVGX)）\n\nPanasonic 其實有出兩台水箱式的，但是台灣沒有公司貨，大台的水貨的價錢又不夠漂亮就不推了。小台的長得超級可愛，價錢也不錯倒是可以考慮，他小到一次只能洗 1.5 人份的碗盤，真的不知道怎麼用。（[代購商品頁](https://jpbuyit.com/?product=%e9%a0%90%e8%b3%bc-panasonic-np-tml1-%e5%96%ae%e4%ba%ba%e6%b4%97%e7%a2%97%e6%a9%9f-%e4%b8%8d%e9%9c%80%e5%ae%89%e8%a3%9d)）\n\n## 獨立落地式\n\n基本上只有 Bosch 可以選。不是，誰家有地方放獨立洗碗機啊啊啊啊啊，連要放在中島都沒辦法進水排水吧。\n\n## 為什麼一定要買\n\n洗碗機這玩意很反常識的，他洗碗比你省水、比你省電、甚至比你洗的更乾淨。唯一的缺點是洗比較久，不過久是他在久，又不需要佔用你的時間，你就安心的坐在客廳等他洗就好了。這就是生活品質（揮揮\n\n強者我朋友 Emil Wu 寫了文情並茂的 FAQ 文，常見的問題都有涵蓋到囉。（[Emil Wu 的 FAQ](https://www.facebook.com/emilwu/posts/pfbid0CAZFFpyNUAGrDcVdvGKgYipsAxj8b5c9bqsaijvtQnEchZy2kwLfSEYg8UDz9mXdl)）",
  "source_url": "https://www.facebook.com/share/p/1BfQzLEkdQ/",
  "image_file": null,
  "image_url": null,
  "category_ids": [
    "kitchen-appliance"
  ],
  "tag_ids": [
    "kitchen"
  ],
  "related_product_ids": [],
  "created_at": "2026-06-19T00:00:00+08:00",
  "updated_at": "2026-06-19T00:00:00+08:00",
  "published_at": "2026-06-19T00:00:00+08:00",
  "unpublished_at": null,
  "archived_at": null
}
