{
  "id": "2026-06-19-pudding-vs-panna-cotta",
  "slug": "2026-06-19-pudding-vs-panna-cotta",
  "status": "published",
  "title": "布丁與奶酪的差別",
  "short_description": "用一張解釋圖說明布丁與奶酪（panna cotta／custard 類）在凝固原理與成分上的差別，方便日後跟人解釋；留言串延伸討論茶碗蒸、三色蛋、豆腐算不算布丁。輕鬆的飲食冷知識。",
  "body": "感謝香蕉同學幫我做了這張圖，這樣我以後比較容易跟人解釋布丁跟奶酪的不同。\n\n（下一則新聞讓我們繼續來關心英國布丁",
  "source_url": "https://www.facebook.com/share/p/1DFtFhxnHs/",
  "image_file": "2026-06-19-pudding-vs-panna-cotta.jpg",
  "image_url": null,
  "category_ids": [
    "other"
  ],
  "tag_ids": [],
  "related_product_ids": [],
  "created_at": "2026-06-19T00:00:00+08:00",
  "updated_at": "2026-06-19T00:00:00+08:00",
  "published_at": "2026-06-19T00:00:00+08:00",
  "unpublished_at": null,
  "archived_at": null
}
