{
  "id": "2026-06-19-tokyo-pudding-tour",
  "slug": "2026-06-19-tokyo-pudding-tour",
  "status": "published",
  "title": "東京布丁巡禮",
  "short_description": "2024 黃金週東京吃布丁巡禮總集篇，作者走訪多家布丁店並整理成 Google Maps 清單，點名三家推薦：蔵前『Westside Coffee』、浅草『Coffee Counter Nishiya』、関內（橫濱）『Café emo.』。",
  "body": "總集篇一下。我這次是有預謀（？）的在吃布丁的，而且我還有把有興趣的店貼了清單。（[Google Maps 清單](https://maps.app.goo.gl/YjS9WaEia9nSMX6BA?g_st=i)）\n\n這次的推薦榜是：\n\n- 蔵前駅 Westside Coffee\n- 浅草駅 Coffee Counter Nishiya\n- 関内駅 Café emo.\n\n地址再分別貼在每一篇。",
  "source_url": "https://www.facebook.com/share/p/1LJbKVGGWv/",
  "image_file": "2026-06-19-tokyo-pudding-tour.jpg",
  "image_url": null,
  "category_ids": [
    "other"
  ],
  "tag_ids": [],
  "related_product_ids": [],
  "created_at": "2026-06-19T00:00:00+08:00",
  "updated_at": "2026-06-19T00:00:00+08:00",
  "published_at": "2026-06-19T00:00:00+08:00",
  "unpublished_at": null,
  "archived_at": null
}
